{
  "garment_id": "DENIM_0001",
  "protocol_version": "0.1",
  "acquisition_source": "",
  "acquisition_price_usd": null,
  "brand_optional": null,
  "garment_style": "other",
  "wash_shade": "other",
  "fiber_composition": "",
  "elastane_percentage": 0,
  "mass_grams": null,
  "fabric_thickness_mm": null,
  "waist_cm": null,
  "front_rise_cm": null,
  "leg_opening_cm": null,
  "original_inseam_cm": null,
  "target_inseam_cm": null,
  "cut_path_coordinates": null,
  "cut_tool": null,
  "cut_operator": null,
  "cut_legs_together": false,
  "wash": null,
  "capture_device": null,
  "capture_calibration": null,
  "before_image_paths": [],
  "marked_image_paths": [],
  "immediate_after_image_paths": [],
  "post_wash_image_paths": [],
  "segmentation_masks": [],
  "landmarks": null,
  "existing_damage_annotations": [],
  "fray_measurements": null,
  "quality_flags": [],
  "protocol_deviations": [],
  "dataset_split": "unassigned"
}
